{
  "$schema": "https://json-schema.org/draft/2020-12/schema",
  "$id": "https://trace.adastra.computer/schemas/upstream-ref-schema.json",
  "title": "trace upstream-ref",
  "description": "UpstreamRefResolver output at <bundle-dir>/upstream-ref.json. Deterministically (or with LLM-assisted release-notes parsing validated against hard rules) identifies the qualifying upstream fix per §2a of SPEC.md, or records an ineligibility verdict. Patcher treats this document as given truth; Patcher never re-litigates eligibility.",
  "type": "object",
  "required": [
    "schema_version",
    "cve_id",
    "current_version",
    "eligibility",
    "replay_critical"
  ],
  "additionalProperties": false,
  "properties": {
    "schema_version": {
      "description": "1.0.0: original (no prefetch_* fields). 1.1.0: adds prefetch_hashes[] / prefetch_failures[] / prefetch_skips[] / prefetch_kind / derivation_command, plus go-mod-vendor source enum value. Bundles that emit any prefetch_* field MUST declare 1.1.0; legacy 1.0.0 bundles are still accepted.",
      "type": "string",
      "enum": ["1.0.0", "1.1.0"]
    },
    "cve_id": { "type": "string", "pattern": "^CVE-\\d{4}-\\d{4,19}$" },
    "current_version": { "type": "string", "minLength": 1 },
    "target_version": {
      "description": "The upstream version containing the fix. Required when eligibility.verdict == eligible.",
      "type": "string"
    },
    "fix_tier": {
      "description": "Classification per §2a. Required when eligibility.verdict == eligible.",
      "type": "string",
      "enum": ["security-patch-release", "point-release-small-delta", "major-version-jump"]
    },
    "release_url": { "type": "string", "format": "uri" },
    "tag": { "type": "string" },
    "advisory_urls": {
      "type": "array",
      "items": { "type": "string", "format": "uri" }
    },
    "changelog_url": { "type": "string", "format": "uri" },
    "upstream_fix_commits": {
      "type": "array",
      "items": {
        "type": "object",
        "required": ["repo_url", "commit_sha"],
        "additionalProperties": false,
        "properties": {
          "repo_url": { "type": "string", "format": "uri" },
          "commit_sha": { "type": "string", "pattern": "^[0-9a-f]{7,40}$" },
          "message": { "type": "string" }
        }
      }
    },
    "prefetch_hashes": {
      "description": "Deterministically-acquired ground-truth hashes for the resolved upstream target. UpstreamRefResolver owns hash acquisition (e.g. nix-prefetch-url, gh release archive, locked vendor lockfile prefetch) and writes the values here BEFORE the Patcher is invoked. Patcher may emit a hash value in patch.diff ONLY if that exact value appears under prefetch_hashes[].value; any other hash value triggers refusal rule 8. List-shaped because the set of hash-bearing attributes varies by ecosystem (src.hash, vendorHash, cargoHash, npmDepsHash, pnpmDepsHash, yarnDepsHash, cargoSha256, …).",
      "type": "array",
      "items": {
        "type": "object",
        "required": ["name", "algorithm", "value", "source", "prefetch_kind", "replay_critical"],
        "additionalProperties": false,
        "properties": {
          "name": {
            "description": "The Nix attribute name this hash belongs to (e.g. 'src.hash', 'vendorHash', 'cargoHash', 'npmDepsHash'). Patcher matches by exact name.",
            "type": "string",
            "minLength": 1
          },
          "algorithm": {
            "type": "string",
            "enum": ["sha256", "sha512", "blake2b-512"]
          },
          "value": {
            "description": "The hash value the Patcher is permitted to emit verbatim. Format follows the algorithm: SRI form for sha256/sha512 (e.g. 'sha256-...=') is the v0 default.",
            "type": "string",
            "minLength": 1
          },
          "source": {
            "description": "How the hash was acquired, for replay attribution.",
            "type": "string",
            "enum": ["nix-prefetch-url", "nix-prefetch-git", "github-release-archive", "gitlab-release-archive", "vendor-lockfile-prefetch", "go-mod-vendor", "manual-pinned"]
          },
          "prefetch_kind": {
            "description": "Mechanism class. `url` fetches a single artifact at a URL and hashes it. `go-mod-vendor` runs a Nix-overlay build that triggers Go's module-vendoring step and captures the resulting fixed-output hash (output applies to vendorHash). Future kinds (cargo-vendor, npm-deps, …) will land separately. Required from schema_version 1.1.0 onward; emitters MUST write the field verbatim rather than relying on a default. Consumers reading legacy 1.0.0 bundles (which don't have this field) should treat absence as `url`.",
            "type": "string",
            "enum": ["url", "go-mod-vendor"]
          },
          "derivation_command": {
            "description": "Exact command (or derivation target) used when prefetch_kind != url. Required when prefetch_kind == go-mod-vendor; lets future replay reproduce the acquisition.",
            "type": "string"
          },
          "url": {
            "description": "The exact URL the hash was prefetched against, when applicable. Required for source=nix-prefetch-url and source=github-release-archive / gitlab-release-archive.",
            "type": "string",
            "format": "uri"
          },
          "tool": {
            "description": "The exact tool binary name invoked to produce the hash. Optional on manually-pinned entries; required when source matches a live-prefetch enum.",
            "type": "string",
            "minLength": 1
          },
          "tool_version": {
            "description": "Version string of the tool, captured at fetch time for replay attribution. Recorded verbatim from `<tool> --version`.",
            "type": "string"
          },
          "fetched_at": {
            "description": "UTC timestamp (ISO-8601) when the prefetch ran.",
            "type": "string",
            "format": "date-time"
          },
          "replay_critical": { "type": "boolean", "const": true }
        }
      }
    },
    "prefetch_skips": {
      "description": "Structured record of hash slots the resolver KNEW it could not prefetch in v0 (as distinct from prefetch_failures[], which records prefetches that were attempted and failed). Patcher reads this field: a slot listed in prefetch_skips[] with required_for_patch=true is an auditable reason to refuse under rule 8 even when the operator hand-populated other prefetch_hashes[] entries. UpstreamRefResolver writes one entry per skipped slot.",
      "type": "array",
      "items": {
        "type": "object",
        "required": ["name", "reason", "required_for_patch"],
        "additionalProperties": false,
        "properties": {
          "name": {
            "description": "The Nix attribute name the slot is for (e.g. 'vendorHash', 'cargoHash').",
            "type": "string",
            "minLength": 1
          },
          "reason": {
            "description": "Why the resolver skipped this slot. Distinct from prefetch_failures[].reason because nothing was attempted.",
            "type": "string",
            "enum": [
              "ecosystem-not-url-derivable",
              "ecosystem-not-supported",
              "url-template-too-complex",
              "missing-target-version",
              "missing-tag",
              "no-derivable-rule",
              "low-confidence-not-auto-prefetched",
              "go-mod-vendor-prefetch-failed"
            ]
          },
          "required_for_patch": {
            "description": "True iff the resolver believes a merge-ready patch must update this hash (e.g. vendorHash detected in package.nix when the patch bumps version). When true, Patcher MUST refuse with rule 8 if no grounded value is supplied for the slot via any other channel. False entries are informational.",
            "type": "boolean"
          },
          "detail": {
            "description": "Free-form additional detail for replay / Steward debugging.",
            "type": "string",
            "maxLength": 2048
          }
        }
      }
    },
    "prefetch_failures": {
      "description": "Structured record of prefetch attempts that did NOT produce a usable hash. Recording failures here (instead of on prefetch_hashes[] or omitting silently) lets Patcher's refusal rule 8 fire deterministically while preserving replay attribution. Patcher reads this field for the same reason it reads prefetch_skips[]: a failure entry with required_for_patch=true is an auditable refusal trigger.",
      "type": "array",
      "items": {
        "type": "object",
        "required": ["name", "reason", "required_for_patch"],
        "additionalProperties": false,
        "properties": {
          "name": {
            "description": "The Nix attribute name the prefetch was for (e.g. 'src.hash').",
            "type": "string",
            "minLength": 1
          },
          "url_attempted": {
            "description": "The URL the resolver tried, when applicable.",
            "type": "string",
            "format": "uri"
          },
          "tool": {
            "type": "string"
          },
          "tool_version": {
            "type": "string"
          },
          "attempted_command": {
            "description": "Exact command (or derivation target) attempted. Mirrors prefetch_hashes[].derivation_command for go-mod-vendor failures so that a translated skip preserves attribution.",
            "type": "string"
          },
          "reason": {
            "description": "Structured failure reason. v0 enum is small; extend as new failure modes appear.",
            "type": "string",
            "enum": [
              "url-not-derivable",
              "tool-not-on-path",
              "fetch-error-404",
              "fetch-error-other",
              "tool-exit-nonzero",
              "tool-output-unparseable",
              "ecosystem-not-supported",
              "go-mod-vendor-prefetch-failed"
            ]
          },
          "required_for_patch": {
            "description": "True iff the resolver believes a merge-ready patch must update this hash (mirrors the prefetch_skips[] semantic). When true, Patcher MUST refuse with rule 8 if no grounded value is supplied for the slot via any other channel.",
            "type": "boolean"
          },
          "detail": {
            "description": "Free-form additional detail (stderr excerpt, exit code, etc.) for debugging. Truncated to 2 KiB.",
            "type": "string",
            "maxLength": 2048
          },
          "attempted_at": {
            "type": "string",
            "format": "date-time"
          }
        }
      }
    },
    "delta": {
      "description": "Summary of what else changes between current_version and target_version. Required when eligibility.verdict == eligible so Patcher rationale can quote it.",
      "type": "object",
      "required": [
        "transitive_package_changes",
        "new_direct_deps",
        "crosses_large_delta_threshold"
      ],
      "additionalProperties": false,
      "properties": {
        "transitive_package_changes": { "type": "integer", "minimum": 0 },
        "new_direct_deps": {
          "type": "array",
          "items": { "type": "string" }
        },
        "removed_direct_deps": {
          "type": "array",
          "items": { "type": "string" }
        },
        "crosses_large_delta_threshold": {
          "description": "True if the configured threshold (v0 default: >10 transitive changes OR any new direct dep) is exceeded. If true and the bundle proceeds, kind MUST be human-review-required.",
          "type": "boolean"
        },
        "threshold_policy": {
          "type": "string",
          "description": "Name of the threshold policy applied, for replay."
        }
      }
    },
    "eligibility": {
      "type": "object",
      "required": ["verdict"],
      "additionalProperties": false,
      "properties": {
        "verdict": {
          "type": "string",
          "enum": [
            "eligible",
            "eligible-requires-human-review",
            "ineligible-no-fix-available",
            "ineligible-major-version-only",
            "ineligible-cherry-pick-required",
            "ineligible-low-confidence-mapping",
            "ineligible-no-upstream-ref"
          ]
        },
        "verdict_reason": {
          "description": "Required for any verdict != eligible. Free text citing resolver rules.",
          "type": "string"
        },
        "human_review_trigger": {
          "description": "Required when verdict == eligible-requires-human-review. Which rule forced human review.",
          "type": "string",
          "enum": ["major-version-jump", "large-sbom-delta", "ambiguous-changelog"]
        }
      },
      "allOf": [
        {
          "if": { "properties": { "verdict": { "const": "eligible" } } },
          "then": { "not": { "required": ["verdict_reason", "human_review_trigger"] } }
        },
        {
          "if": { "properties": { "verdict": { "const": "eligible-requires-human-review" } } },
          "then": { "required": ["verdict_reason", "human_review_trigger"] }
        },
        {
          "if": { "properties": { "verdict": { "pattern": "^ineligible-" } } },
          "then": { "required": ["verdict_reason"] }
        }
      ]
    },
    "replay_critical": { "type": "boolean", "const": true }
  },
  "allOf": [
    {
      "if": {
        "properties": {
          "eligibility": {
            "properties": {
              "verdict": { "enum": ["eligible", "eligible-requires-human-review"] }
            }
          }
        }
      },
      "then": {
        "required": ["target_version", "fix_tier", "release_url", "delta"]
      }
    },
    {
      "if": {
        "required": ["fix_tier"],
        "properties": {
          "fix_tier": { "const": "major-version-jump" }
        }
      },
      "then": {
        "properties": {
          "eligibility": {
            "properties": {
              "verdict": { "const": "eligible-requires-human-review" }
            }
          }
        }
      }
    },
    {
      "description": "Bundles that emit any prefetch_* field MUST declare schema_version 1.1.0. Legacy 1.0.0 bundles cannot use prefetch_* additive fields (the resolver had not yet acquired hashes when the original schema landed).",
      "if": {
        "anyOf": [
          { "required": ["prefetch_hashes"] },
          { "required": ["prefetch_failures"] },
          { "required": ["prefetch_skips"] }
        ]
      },
      "then": {
        "properties": {
          "schema_version": { "const": "1.1.0" }
        }
      }
    }
  ]
}
