{
  "schema_version": "1.0.0",
  "cve_id": "CVE-0000-9006",
  "current_version": "1.4.7",
  "target_version": "2.0.0",
  "fix_tier": "major-version-jump",
  "release_url": "https://example.invalid/libexample/releases/2.0.0",
  "advisory_urls": ["https://example.invalid/advisory/LIBEXAMPLE-2026-0006"],
  "changelog_url": "https://example.invalid/libexample/CHANGELOG#v2.0.0",
  "upstream_fix_commits": [
    { "repo_url": "https://example.invalid/libexample", "commit_sha": "def5678", "message": "fix: CVE-0000-9006 addressed only in 2.x; upstream refuses backport" }
  ],
  "delta": {
    "transitive_package_changes": 14,
    "new_direct_deps": ["libfrob"],
    "removed_direct_deps": ["libold"],
    "crosses_large_delta_threshold": true,
    "threshold_policy": "v0-default"
  },
  "eligibility": {
    "verdict": "eligible-requires-human-review",
    "verdict_reason": "Upstream maintainer comment on advisory confirms the fix is only present on the 2.x branch and will not be backported to 1.x. Major version jump required.",
    "human_review_trigger": "major-version-jump"
  },
  "replay_critical": true
}
