{
  "schema_version": "1.0.0",
  "cve_id": "CVE-0000-1013",
  "current_version": "1.0.0",
  "target_version": "1.0.1",
  "fix_tier": "point-release-small-delta",
  "release_url": "https://example.invalid/libexample/releases/1.0.1",
  "delta": {
    "transitive_package_changes": 1,
    "new_direct_deps": [],
    "removed_direct_deps": [],
    "crosses_large_delta_threshold": false,
    "threshold_policy": "v0-default"
  },
  "replay_critical": true,
  "tag": "v1.0.1",
  "advisory_urls": [
    "https://example.invalid/advisory/LIBEXAMPLE-2026-0013"
  ],
  "changelog_url": "https://example.invalid/libexample/CHANGELOG#v1.0.1",
  "upstream_fix_commits": [
    {
      "repo_url": "https://example.invalid/libexample",
      "commit_sha": "abc1013"
    }
  ],
  "eligibility": {
    "verdict": "eligible"
  }
}
