{
  "schema_version": "1.0.0",
  "cve_id": "CVE-0000-9003",
  "current_version": "1.4.7",
  "target_version": "1.4.8",
  "fix_tier": "security-patch-release",
  "release_url": "https://example.invalid/libexample/releases/1.4.8",
  "tag": "v1.4.8",
  "advisory_urls": ["https://example.invalid/advisory/LIBEXAMPLE-2026-0003"],
  "changelog_url": "https://example.invalid/libexample/CHANGELOG#v1.4.8",
  "upstream_fix_commits": [
    {
      "repo_url": "https://example.invalid/libexample",
      "commit_sha": "abc1234",
      "message": "fix(tls): bound handshake parser loop (CVE-0000-9003)"
    }
  ],
  "delta": {
    "transitive_package_changes": 1,
    "new_direct_deps": [],
    "removed_direct_deps": [],
    "crosses_large_delta_threshold": false,
    "threshold_policy": "v0-default"
  },
  "eligibility": { "verdict": "eligible" },
  "replay_critical": true
}
