{
  "schema_version": "1.0.0",
  "cve_id": "CVE-0000-1003",
  "current_version": "1.4.7",
  "target_version": "2.0.0",
  "fix_tier": "major-version-jump",
  "release_url": "https://example.invalid/libexample/releases/2.0.0",
  "delta": {
    "transitive_package_changes": 14,
    "new_direct_deps": ["libfrob"],
    "removed_direct_deps": ["libold"],
    "crosses_large_delta_threshold": false,
    "threshold_policy": "v0-default"
  },
  "replay_critical": true,
  "tag": "v2.0.0",
  "advisory_urls": ["https://example.invalid/advisory/LIBEXAMPLE-2026-0003"],
  "changelog_url": "https://example.invalid/libexample/CHANGELOG#v2.0.0",
  "upstream_fix_commits": [
    { "repo_url": "https://example.invalid/libexample", "commit_sha": "feed000", "message": "fix only in 2.x branch" }
  ],
  "eligibility": {
    "verdict": "eligible-requires-human-review",
    "verdict_reason": "fix is only present on a new major version; per §2a auto-merge is forbidden without explicit human sign-off",
    "human_review_trigger": "major-version-jump"
  }
}
