{
  "schema_version": "1.1.0",
  "cve_id": "CVE-2025-9820",
  "current_version": "3.8.10",
  "target_version": "3.8.11",
  "fix_tier": "point-release-small-delta",
  "release_url": "https://lists.gnupg.org/pipermail/gnutls-help/2025-November/004906.html",
  "delta": {
    "transitive_package_changes": 0,
    "new_direct_deps": [],
    "removed_direct_deps": [],
    "crosses_large_delta_threshold": false,
    "threshold_policy": "v0-default"
  },
  "replay_critical": true,
  "tag": "3.8.11",
  "advisory_urls": [
    "https://nvd.nist.gov/vuln/detail/CVE-2025-9820",
    "https://www.gnutls.org/security-new.html#GNUTLS-SA-2025-11-18"
  ],
  "changelog_url": "https://gitlab.com/gnutls/gnutls/-/raw/3.8.11/NEWS",
  "upstream_fix_commits": [],
  "eligibility": {
    "verdict": "eligible",
    "verdict_reason": "Clean security patch release 3.8.10->3.8.11. CVE-2025-9820 CWE-121 stack-based buffer overflow in gnutls_pkcs11_token_init(). bundle.kind=human-review-required (blast-radius-exceeds-threshold; gnutls reverse_closure>500). Patcher must update version from 3.8.10 to 3.8.11 and hash from sha256-23+rfM55Hncn677yM0MByCHXmlUOxVye8Ja2ELA+trc= to sha256-kb0jxKhuvGFS6BMD0gz2zq65e8j4QmbQ+uxuKfF7qiA= (the fetchurl url uses ${version} so no url edit is needed)."
  },
  "prefetch_hashes": [
    {
      "name": "src.hash",
      "algorithm": "sha256",
      "value": "sha256-kb0jxKhuvGFS6BMD0gz2zq65e8j4QmbQ+uxuKfF7qiA=",
      "source": "manual-pinned",
      "prefetch_kind": "url",
      "tool": "nix-prefetch-url",
      "fetched_at": "2026-06-10T00:00:00Z",
      "url": "https://www.gnupg.org/ftp/gcrypt/gnutls/v3.8/gnutls-3.8.11.tar.xz",
      "replay_critical": true
    }
  ]
}
